Category,Guideline,Description,Do,Dont,Code Good,Code Bad,Severity,Docs URL
Security,Deep Link Validation,Deep links (Intent filters App Links) can be exploited if parameters aren't validated. Attackers can craft malicious URIs to trigger unintended actions inject data or access unauthorized content. Validate all URI parameters against whitelist regex. Verify host and scheme. Don't trust deep link data for sensitive operations without authentication. Use App Links (https scheme) with Digital Asset Links for verified domains.,Validate all URI parameters with regex whitelist; verify host and scheme; require authentication for sensitive deep link actions; use verified App Links,Trust all deep link parameters; no validation; allow any host; perform sensitive actions from unverified deep links,"// Validate deep link: val uri = intent.data ?: return; if (uri.scheme != 'https' || uri.host != 'myapp.com') { finish(); return }; val itemId = uri.getQueryParameter('id')?.takeIf { it.matches(Regex('^[a-zA-Z0-9]{1,20}$')) } ?: run { finish(); return }; // Verify domain with App Links: <intent-filter android:autoVerify='true'><data android:scheme='https' android:host='myapp.com' /></intent-filter>",val uri = intent.data; val action = uri.getQueryParameter('action'); executeAction(action) // Can execute arbitrary malicious actions,Critical,https://developer.android.com/privacy-and-security/risks/unsafe-use-of-deeplinks
Security,SQL Injection Prevention Best Practices,SQL injection occurs when user input is concatenated into SQL queries allowing attackers to execute arbitrary SQL. Always use parameterized queries with Room @Query or SQLiteDatabase query() methods with selectionArgs. Never use rawQuery with string concatenation. Validate input before queries. Use ContentProvider with proper URI validation. Room compile-time verification prevents most SQL injection.,Use Room @Query with parameters; use query() with selectionArgs; validate inputs; never concatenate user input into SQL,Use rawQuery with string concatenation; concatenate user input into WHERE clauses; no input validation,"// Room (recommended): @Query('SELECT * FROM users WHERE email = :email AND active = :active') fun findUser(email: String, active: Boolean): User?; // SQLiteDatabase: val cursor = db.query('users', null, 'email = ? AND active = ?', arrayOf(email, active.toString()), null); // Input validation: val safeInput = input.takeIf { it.matches(Regex('^[a-zA-Z0-9@._-]+$')) } ?: throw IllegalArgumentException()",db.rawQuery('SELECT * FROM users WHERE email = $userInput') // Attacker can input: admin@example.com' OR '1'='1,Critical,https://developer.android.com/training/data-storage/room/accessing-data
Security,Google Play Data Safety Declaration,As of 2026 Google Play requires all apps to accurately complete the Data Safety form disclosing data collection sharing and security practices. Developers must declare data handled by third-party libraries/SDKs. Update declarations when data practices change. Failure to accurately disclose leads to app rejection or removal. Use Play Console Data Safety section to declare: data types collected purposes sharing practices retention encryption.,Accurately complete Data Safety form; declare all data collection including third-party SDKs; update when practices change; review before each release,Skip Data Safety declaration; incomplete or inaccurate information; don't declare SDK data collection; never update,// Review all dependencies' privacy policies: dependencies.forEach { reviewPrivacyPolicy(it) }; // Data Safety checklist: Location: Collected for maps analytics? User Data: Email name collected? Shared with third parties? Encrypted in transit/at rest? // Update in Play Console before every release; // Document SDK data practices in internal privacy audit,No Data Safety form or incomplete declaration; SDK data collection not disclosed,Critical,https://support.google.com/googleplay/android-developer/answer/10787469
Security,Photo/Video Permission Declaration,Google Play 2026 policy requires apps requesting READ_MEDIA_IMAGES or READ_MEDIA_VIDEO to submit declaration form justifying use. Apps must demonstrate these permissions are core to app functionality or remove them. Alternatives: use photo picker (no permission needed) request specific media types only use scoped storage. Apps without valid justification will be rejected.,Use photo picker API when possible; justify READ_MEDIA permissions with declaration form; request only necessary media types; consider scoped storage,Request broad photo/video permissions without justification; no declaration form; collect all media files unnecessarily,// Recommended: Photo Picker (no permission): val pickMedia = registerForActivityResult(PickVisualMedia()) { uri -> processPhoto(uri) }; pickMedia.launch(PickVisualMediaRequest(ImageOnly)); // If READ_MEDIA needed justify in Play Console declaration: 'Photo editing app requires access to modify user photos'; // Or scoped storage: MediaStore for specific files,Requesting READ_MEDIA_IMAGES/VIDEO without declaration form or valid core functionality justification,High,https://support.google.com/googleplay/android-developer/answer/14115180
Security,Accessibility API Restrictions,Google Play 2026 explicitly prohibits using Accessibility API for autonomous actions that change settings or circumvent privacy controls without user knowledge. Apps using AccessibilityService must have clear disability-related purpose. Misuse leads to immediate removal. Valid uses: screen readers navigation aids switch access. Invalid: automation ad clicking data harvesting bypassing security.,Use Accessibility API only for legitimate disability assistance; clear user disclosure; avoid autonomous actions changing settings,Misuse Accessibility API for automation ad clicking or bypassing security; no disclosure; background autonomous actions,// Valid use: class ScreenReaderService : AccessibilityService() { override fun onAccessibilityEvent(event: AccessibilityEvent) { announceForAccessibility(event.contentDescription) } }; // Manifest disclosure: \u003cservice android:name='.ScreenReaderService' android:permission='android.permission.BIND_ACCESSIBILITY_SERVICE'\u003e\u003cmeta-data android:name='android.accessibilityservice' android:resource='@xml/accessibility_service_config' /\u003e\u003c/service\u003e,Using AccessibilityService to: auto-click ads; harvest data from other apps; change system settings without permission; bypass security prompts,Critical,https://support.google.com/googleplay/android-developer/answer/13820226
Security,In-App Update Security,Google Play in-app updates allow seamless updates without leaving the app. Implement with AppUpdateManager using flexible or immediate modes. Validate update availability with Play Core library. Security: updates are signed and verified by Play Store encrypted in transit user must approve. Handle update failures gracefully. Test with internal testing track. Priority: high priority for critical security patches.,Use AppUpdateManager for in-app updates; handle flexible and immediate modes; prioritize security patches; test thoroughly; handle failures gracefully,No in-app update mechanism; force users to manual updates; no update priority for security fixes; untested update flow,"// Add dependency: implementation 'com.google.android.play:app-update:2.1.0'; val appUpdateManager = AppUpdateManagerFactory.create(context); appUpdateManager.appUpdateInfo.addOnSuccessListener { info -> if (info.updateAvailability() == UpdateAvailability.UPDATE_AVAILABLE && info.isUpdateTypeAllowed(AppUpdateType.IMMEDIATE)) { appUpdateManager.startUpdateFlowForResult(info, AppUpdateType.IMMEDIATE, activity, REQUEST_CODE) } }",No update mechanism; users stay on vulnerable versions; manual Play Store navigation required; security patches delayed,High,https://developer.android.com/guide/playcore/in-app-updates
Security,OWASP M1: Improper Credential Usage,OWASP Mobile Top 10 2024 M1 covers insecure credential handling storage and transmission. Never hardcode credentials API keys tokens. Use Android Keystore for sensitive keys EncryptedSharedPreferences for auth tokens. Implement strong authentication (MFA biometrics) token rotation secure password policies. Validate credentials server-side. Clear credentials on logout.,Use Android Keystore for keys; EncryptedSharedPreferences for tokens; implement MFA biometrics; token rotation; never hardcode credentials,Hardcode API keys passwords; store tokens in plain SharedPreferences; weak authentication; no token rotation; credentials in git,"// Generate key in Keystore: val keyGenerator = KeyGenerator.getInstance(KeyProperties.KEY_ALGORITHM_AES, 'AndroidKeyStore'); keyGenerator.init(KeyGenParameterSpec.Builder('auth_key', PURPOSE_ENCRYPT or PURPOSE_DECRYPT).setBlockModes(BLOCK_MODE_GCM).setEncryptionPaddings(ENCRYPTION_PADDING_NONE).build()); // Store token: EncryptedSharedPreferences encrypted token; // MFA: BiometricPrompt for sensitive operations",const val API_KEY = 'sk_live_abc123'; // Hardcoded exposed in APK; SharedPreferences.edit().putString('token' authToken) // Plaintext storage,Critical,https://owasp.org/www-project-mobile-top-10/
Security,OWASP M4: Insufficient Input Validation,OWASP M4 addresses injection attacks from unvalidated input. Validate all user input deep link parameters intent extras API responses with regex whitelisting length checks type validation. Sanitize output to prevent XSS. Use parameterized queries for SQL Room @Query. Validate file uploads. Check data types bounds special characters.,Validate all inputs with regex whitelist length type checks; sanitize outputs; parameterized queries; validate intents deep links API data,Trust all user input; no validation; string concatenation for SQL; accept any file upload; no sanitization,"// Input validation: fun validateEmail(input: String): String? = input.takeIf { it.matches(Regex('^[a-zA-Z0-9._%+-]+@[a-zA-Z0-9.-]+\\\\.[a-zA-Z]{2,}$')) && it.length \u003c= 254 }; // Deep link validation: val userId = uri.getQueryParameter('id')?.takeIf { it.matches(Regex('^[0-9]{1,10}$')) } ?: return; // SQL: @Query('SELECT * WHERE id = :id') parameterized",val userId = intent.getStringExtra('user_id'); deleteUser(userId) // No validation - injection; db.rawQuery('SELECT * WHERE name = $input') // SQL injection,Critical,https://owasp.org/www-project-mobile-top-10/
Security,OWASP M8: Security Misconfiguration,OWASP M8 covers misconfigurations: android:debuggable=true in production insecure defaults excessive permissions weak encryption cleartext traffic debug code shipped. Review: remove debug features use android:debuggable=false minimize permissions enforce HTTPS disable unused features secure default configurations production-ready builds.,Remove all debug code; android:debuggable=false; minimize permissions; HTTPS only; secure defaults; review before release,Ship with android:debuggable=true; debug features enabled; excessive permissions; HTTP allowed; insecure defaults; no configuration review,// Release build (build.gradle.kts): buildTypes { release { isDebuggable = false; isMinifyEnabled = true; proguardFiles(getDefaultProguardFile('proguard-android-optimize.txt')) } }; // AndroidManifest: \u003capplication android:debuggable='false' android:allowBackup='false'\u003e; // Network: \u003cnetwork-security-config\u003e\u003cbase-config cleartextTrafficPermitted='false'\u003e; // Minimal permissions,\u003capplication android:debuggable='true'\u003e in production; debug logs enabled; \u003cuses-permission android:name='android.permission.READ_CONTACTS' /\u003e unused; cleartextTrafficPermitted='true',High,https://owasp.org/www-project-mobile-top-10/
Security,OWASP M9: Insecure Data Storage,OWASP M9 addresses storing sensitive data insecurely. Encrypt all sensitive data at rest using EncryptedSharedPreferences EncryptedFile Room with SQLCipher. Use Android Keystore for key management. Don't store in: plain SharedPreferences external storage logs temporary files. Implement data retention policies secure deletion. Exclude sensitive data from backups.,Encrypt data at rest with EncryptedSharedPreferences EncryptedFile Room+SQLCipher; use Keystore; exclude from backups; secure deletion,Store sensitive data in plain SharedPreferences; external storage; no encryption; included in backups; no deletion policy,"// Encrypted storage: val masterKey = MasterKey.Builder(context).setKeyScheme(AES256_GCM).build(); val encryptedPrefs = EncryptedSharedPreferences.create(context, 'secure_prefs', masterKey, AES256_SIV, AES256_GCM); encryptedPrefs.edit().putString('token', authToken).apply(); // Backup exclusion: \u003cfull-backup-content\u003e\u003cexclude domain='sharedpref' path='secure_prefs.xml'/\u003e\u003c/full-backup-content\u003e","val prefs = getSharedPreferences('prefs', MODE_PRIVATE); prefs.edit().putString('password', userPassword).apply() // Plaintext readable via ADB backup; File(externalStorageDirectory, 'sensitive.txt').writeText(data) // Public storage",Critical,https://owasp.org/www-project-mobile-top-10/
Security,Third-Party SDK Compliance,Google Play 2026 increases scrutiny on third-party SDKs requiring developers to ensure SDK compliance with policies especially data collection background behavior. Review SDK privacy policies update regularly vet before integration use dependency scanning declare SDK data in Data Safety. Non-compliant SDKs lead to app rejection. Check SDK permissions network access data harvesting.,Vet all SDKs before integration; review privacy policies; dependency scanning; keep updated; declare in Data Safety; remove non-compliant SDKs,Use SDKs without vetting; outdated versions; no privacy review; undeclared in Data Safety; unknown data collection,// SDK vetting checklist: 1. Review privacy policy; 2. Check permissions SDK requests; 3. Scan with: ./gradlew dependencyCheckAnalyze; 4. Monitor SDK behavior with network proxy; 5. Declare in Data Safety; 6. Update regularly; // Use trusted SDKs: dependencies { implementation('androidx.security:security-crypto:1.1.0-alpha06') // Google official }; // Remove suspicious SDKs with excessive permissions or unknown data collection,dependencies { implementation('com.unknown:analytics:1.0.0') } // Unvetted outdated unknown; SDK requests CONTACTS LOCATION undisclosed; Not declared in Data Safety; Never updated,High,https://support.google.com/googleplay/android-developer/answer/9888076
Security,Runtime Permission Best Practices,Android 6+ requires runtime permissions for dangerous permissions (location camera contacts etc). Request permissions contextually with clear rationale using shouldShowRequestPermissionRationale. Handle denials gracefully. Request minimum permissions. Use permission groups. Check permissions before use. Consider alternatives: photo picker (no permission) approximate location. Alert users why permission needed.,Request permissions at runtime with rationale; minimal permissions; handle denials; explain to users; use alternatives when possible,Request all permissions at install; no rationale; don't handle denials; excessive permissions; no explanation,"// Request with rationale: if (ContextCompat.checkSelfPermission(this, ACCESS_FINE_LOCATION) != PERMISSION_GRANTED) { if (shouldShowRequestPermissionRationale(ACCESS_FINE_LOCATION)) { showRationale('Location needed for nearby stores') } else { requestPermissionLauncher.launch(ACCESS_FINE_LOCATION) } }; // Handle denial: registerForActivityResult(RequestPermission()) { granted -> if (!granted) offerAlternative() }","// Bad: Request all upfront: requestPermissions(arrayOf(CAMERA, CONTACTS, LOCATION, READ_SMS, CALL_PHONE), 0) // No explanation; if (checkSelfPermission(CAMERA) != GRANTED) { finish() } // Don't handle denial",High,https://developer.android.com/training/permissions/requesting
XML Views,ConstraintLayout Flat Hierarchy,"Use ConstraintLayout to create flat view hierarchies instead of deeply nested LinearLayouts or RelativeLayouts. Each nesting level adds a measure and layout pass, degrading performance. ConstraintLayout allows complex layouts with a single level of nesting using constraints, chains, barriers, and guidelines.",Use ConstraintLayout with constraints chains barriers guidelines for complex layouts,Nest multiple LinearLayouts or RelativeLayouts more than 2-3 levels deep,"<androidx.constraintlayout.widget.ConstraintLayout xmlns:app='http://schemas.android.com/apk/res-auto' android:layout_width='match_parent' android:layout_height='wrap_content'><ImageView android:id='@+id/avatar' app:layout_constraintStart_toStartOf='parent' app:layout_constraintTop_toTopOf='parent' /><TextView android:id='@+id/title' app:layout_constraintStart_toEndOf='@id/avatar' app:layout_constraintTop_toTopOf='@id/avatar' /><TextView android:id='@+id/subtitle' app:layout_constraintStart_toEndOf='@id/avatar' app:layout_constraintTop_toBottomOf='@id/title' /></androidx.constraintlayout.widget.ConstraintLayout>","<LinearLayout android:orientation='vertical'><LinearLayout android:orientation='horizontal'><LinearLayout android:orientation='vertical'><TextView /><TextView /></LinearLayout></LinearLayout></LinearLayout> // 3 levels deep for simple layout",High,https://developer.android.com/develop/ui/views/layout/constraint-layout
XML Views,View Binding,"Use View Binding to safely access views instead of findViewById or deprecated Kotlin synthetics. View Binding generates a binding class per XML layout with direct references to all views with IDs. It is null-safe, type-safe, and catches missing views at compile time.",Enable viewBinding in build.gradle; use generated binding classes in Activity Fragment Adapter,Use findViewById or Kotlin synthetics (deprecated),// build.gradle.kts: android { buildFeatures { viewBinding = true } }; // Activity: class MainActivity : AppCompatActivity() { private lateinit var binding: ActivityMainBinding; override fun onCreate(savedInstanceState: Bundle?) { super.onCreate(savedInstanceState); binding = ActivityMainBinding.inflate(layoutInflater); setContentView(binding.root); binding.titleText.text = 'Hello' } },val title = findViewById<TextView>(R.id.titleText) // null at runtime if ID wrong; or import kotlinx.android.synthetic.main.activity_main.* // deprecated,High,https://developer.android.com/topic/libraries/view-binding
XML Views,merge Tag for Include Layouts,"Use <merge> as the root element for layouts meant to be included via <include>. When a layout is included, the <merge> tag is removed and its children are added directly to the parent, eliminating an unnecessary extra ViewGroup layer.",Use <merge> as root for included layouts to eliminate redundant ViewGroup,Use a layout container (LinearLayout FrameLayout) as root of included layouts,"<!-- toolbar_layout.xml --> <merge xmlns:android='http://schemas.android.com/apk/res/android'><ImageView android:id='@+id/icon' /><TextView android:id='@+id/title' /></merge>; <!-- main_layout.xml --> <LinearLayout><include layout='@layout/toolbar_layout' /></LinearLayout>","<!-- toolbar_layout.xml --> <LinearLayout><ImageView /><TextView /></LinearLayout> // extra LinearLayout added when included; deeper hierarchy",Medium,https://developer.android.com/develop/ui/views/layout/improving-layouts/reusing-layouts#Merge
XML Views,include Tag for Layout Reuse,"Use <include> to embed reusable layout fragments into multiple parent layouts. This promotes DRY principle and ensures consistent UI across screens. Override layout_width and layout_height on the <include> tag to customize size per usage.",Extract common UI components into separate layout files and reuse via include,Copy-paste the same layout XML across multiple files,"<!-- common_header.xml --> <TextView android:id='@+id/header' android:layout_width='match_parent' android:layout_height='wrap_content' android:textAppearance='?attr/textAppearanceHeadline6' />; <!-- screen_a.xml --> <LinearLayout><include layout='@layout/common_header' /><RecyclerView /></LinearLayout>","<!-- Copy-paste header in every layout file --> <LinearLayout><TextView android:id='@+id/header' android:layout_width='match_parent' android:layout_height='wrap_content' /><RecyclerView /></LinearLayout> // duplicated in 10 screens; change requires 10 edits",Medium,https://developer.android.com/develop/ui/views/layout/improving-layouts/reusing-layouts
XML Views,RecyclerView ListAdapter with DiffUtil,"Use ListAdapter with DiffUtil.ItemCallback for efficient RecyclerView updates. DiffUtil computes the minimal set of changes (inserts, removes, moves) on a background thread avoiding full notifyDataSetChanged calls which rebind all items.",ListAdapter with DiffUtil.ItemCallback; submitList() for updates,RecyclerView.Adapter with notifyDataSetChanged or manual notify calls,"class UserAdapter : ListAdapter<User, UserViewHolder>(UserDiffCallback()) { override fun onCreateViewHolder(parent: ViewGroup, viewType: Int) = UserViewHolder(ItemUserBinding.inflate(LayoutInflater.from(parent.context), parent, false)); override fun onBindViewHolder(holder: UserViewHolder, position: Int) { holder.bind(getItem(position)) } }; class UserDiffCallback : DiffUtil.ItemCallback<User>() { override fun areItemsTheSame(old: User, new: User) = old.id == new.id; override fun areContentsTheSame(old: User, new: User) = old == new }","class UserAdapter(var items: List<User>) : RecyclerView.Adapter<UserViewHolder>() { fun updateList(new: List<User>) { items = new; notifyDataSetChanged() } } // rebinds all items; flickers; no animations",High,https://developer.android.com/reference/androidx/recyclerview/widget/ListAdapter
XML Views,RecyclerView setHasFixedSize,"Call setHasFixedSize(true) on RecyclerView when the adapter content does not change the RecyclerView size. This skips unnecessary layout recalculations when adapter data changes, improving scrolling performance.",Set setHasFixedSize(true) when RecyclerView size is constant regardless of adapter content,Skip setHasFixedSize causing unnecessary layout passes on data changes,recyclerView.setHasFixedSize(true); recyclerView.layoutManager = LinearLayoutManager(this); recyclerView.adapter = myAdapter,recyclerView.layoutManager = LinearLayoutManager(this); recyclerView.adapter = myAdapter // no setHasFixedSize; unnecessary relayouts,Medium,https://developer.android.com/reference/androidx/recyclerview/widget/RecyclerView#setHasFixedSize(boolean)
XML Views,RecyclerView View Types,"Use getItemViewType() to support multiple view types in RecyclerView. Create different ViewHolder subclasses for each type. Use sealed class/interface for list items to ensure exhaustive handling in when expressions.",Sealed class for item types; getItemViewType returns distinct int per type; typed ViewHolders,Single ViewHolder with visibility toggling for different item layouts,"sealed interface ListItem { data class Header(val title: String) : ListItem; data class Content(val user: User) : ListItem }; class MultiAdapter : ListAdapter<ListItem, RecyclerView.ViewHolder>(DiffCallback()) { override fun getItemViewType(position: Int) = when (getItem(position)) { is ListItem.Header -> TYPE_HEADER; is ListItem.Content -> TYPE_CONTENT }; override fun onCreateViewHolder(parent: ViewGroup, viewType: Int) = when (viewType) { TYPE_HEADER -> HeaderViewHolder(ItemHeaderBinding.inflate(inflater, parent, false)); else -> ContentViewHolder(ItemContentBinding.inflate(inflater, parent, false)) } }","class Adapter : RecyclerView.Adapter<MyViewHolder>() { override fun onBindViewHolder(holder: MyViewHolder, pos: Int) { if (items[pos].isHeader) { holder.contentLayout.visibility = GONE; holder.headerLayout.visibility = VISIBLE } else { holder.contentLayout.visibility = VISIBLE; holder.headerLayout.visibility = GONE } } } // inflates both layouts always; wastes memory",Medium,https://developer.android.com/develop/ui/views/layout/recyclerview-custom#multiple-view-types
XML Views,tools: Namespace for Previews,"Use tools: attributes in XML layouts for design-time preview data without affecting runtime behavior. tools:text, tools:src, tools:listitem, tools:itemCount, tools:visibility provide visual context in Android Studio layout editor.",Use tools:text tools:src tools:listitem for design-time preview data,Hardcode placeholder text in android:text that must be removed before release; or no preview data,"<TextView android:id='@+id/title' android:layout_width='wrap_content' android:layout_height='wrap_content' android:text='@string/title' tools:text='Sample Article Title' />; <RecyclerView android:id='@+id/list' tools:listitem='@layout/item_user' tools:itemCount='5' />","<TextView android:text='Sample Article Title' /> // hardcoded placeholder shipped to production; or <RecyclerView /> // blank in preview; can't visualize list",Low,https://developer.android.com/studio/write/tool-attributes
XML Views,String Resources,"Never hardcode user-facing strings in layouts or code. Extract all strings to res/values/strings.xml for localization support, maintainability, and Play Store translation services. Use string formatting with placeholders for dynamic content.",All user-facing text in strings.xml with descriptive names; use string placeholders for dynamic values,Hardcode strings in XML layout android:text or in Kotlin/Java code,"<TextView android:text='@string/welcome_message' />; <!-- strings.xml --> <string name='welcome_message'>Welcome back %1$s</string>; // Kotlin: getString(R.string.welcome_message, userName)","<TextView android:text='Welcome back' /> // hardcoded; not translatable; // Kotlin: textView.text = 'Welcome back $name' // not localizable",High,https://developer.android.com/guide/topics/resources/string-resource
