Category,Guideline,Description,Do,Dont,Code Good,Code Bad,Severity,Docs URL
XML Views,Multi-Window and Foldable Support,"Design layouts that work in multi-window split-screen and on foldable devices. Set resizeableActivity=true (default for API 24+). Use WindowManager library to detect fold posture and hinge position. Test with different window sizes. Handle onMultiWindowModeChanged and onConfigurationChanged. Never assume full screen ownership.",Set resizeableActivity=true; handle onConfigurationChanged for screenSize|screenLayout|orientation; use Jetpack WindowManager for fold detection; test split-screen,Set resizeableActivity=false; assume full screen; use fixed dimensions; break on window resize; ignore foldable postures,"// AndroidManifest.xml: <activity android:name='.MainActivity' android:resizeableActivity='true' android:configChanges='screenSize|smallestScreenSize|screenLayout|orientation' />; // Detect fold: val windowInfoTracker = WindowInfoTracker.getOrCreate(this); lifecycleScope.launch { windowInfoTracker.windowLayoutInfo(this@MainActivity).collect { layoutInfo -> val foldingFeature = layoutInfo.displayFeatures.filterIsInstance<FoldingFeature>().firstOrNull(); if (foldingFeature?.state == FoldingFeature.State.HALF_OPENED) { adaptToTableTopMode() } } }","<activity android:resizeableActivity='false' /> // breaks multi-window on API 24+; <activity android:screenOrientation='portrait' /> // ignored in multi-window; // Fixed dimensions: android:layout_width='360dp' // breaks on resize; no fold detection; app crashes on split-screen",High,https://developer.android.com/guide/topics/large-screens/multi-window-support
XML Views,SlidingPaneLayout for Large Screens,"Use SlidingPaneLayout for list-detail patterns that show two panes side by side on tablets and foldables while overlapping on phones. SlidingPaneLayout automatically adapts to available width and respects foldable hinge positions. Set minimum widths on children and use layout_weight on detail pane. Integrate with Navigation component via AbstractListDetailFragment.",SlidingPaneLayout with minimum widths on children; layout_weight=1 on detail pane; OnBackPressedCallback for back navigation; no addToBackStack on detail transactions,FrameLayout with manual visibility toggling for list/detail; hardcode tablet detection with screen width checks,"<androidx.slidingpanelayout.widget.SlidingPaneLayout android:id='@+id/sliding_pane' android:layout_width='match_parent' android:layout_height='match_parent'><RecyclerView android:id='@+id/list_pane' android:layout_width='280dp' android:layout_height='match_parent' /><androidx.fragment.app.FragmentContainerView android:id='@+id/detail_pane' android:layout_width='300dp' android:layout_weight='1' android:layout_height='match_parent' /></androidx.slidingpanelayout.widget.SlidingPaneLayout>; // Back handling: val callback = TwoPaneOnBackPressedCallback(slidingPaneLayout); requireActivity().onBackPressedDispatcher.addCallback(viewLifecycleOwner, callback)","// Manual approach: if (resources.configuration.screenWidthDp >= 600) { listContainer.visibility = VISIBLE; detailContainer.visibility = VISIBLE } else { /* toggle visibility manually */ } // error-prone; no fold awareness; no automatic adaptation; complex back handling",Medium,https://developer.android.com/develop/ui/views/layout/twopane
XML Views,Layer-List Drawable,"Use layer-list drawable to stack multiple drawables into a composite background. Each item is drawn in order with the last item on top. Use for complex backgrounds combining shapes gradients icons. Supports offset positioning via left top right bottom attributes and gravity for alignment.",Define layer-list in res/drawable/ with ordered item elements; use offsets for positioning; combine shapes bitmaps and colors,Create complex backgrounds in code with multiple draw calls; use single shape drawable and lose composability,"<!-- res/drawable/badge_background.xml --> <layer-list xmlns:android='http://schemas.android.com/apk/res/android'><item><shape android:shape='oval'><solid android:color='@color/primary' /><size android:width='24dp' android:height='24dp' /></shape></item><item android:top='2dp' android:left='2dp' android:right='2dp' android:bottom='2dp'><shape android:shape='oval'><solid android:color='@color/surface' /></shape></item></layer-list>; <View android:background='@drawable/badge_background' />","// Programmatic: override fun onDraw(canvas: Canvas) { canvas.drawCircle(cx, cy, r, outerPaint); canvas.drawCircle(cx, cy, r-2, innerPaint) } // not reusable; can't apply via XML; custom view needed for simple decoration",Low,https://developer.android.com/guide/topics/resources/drawable-resource#LayerList
XML Views,Ripple Drawable for Touch Feedback,"Use ripple drawable for Material touch feedback. Wrap existing drawables in a ripple element. Use android:attr/selectableItemBackground for default bounded ripple and android:attr/selectableItemBackgroundBorderless for unbounded circular ripple. For custom ripple define explicit color and mask layer.",Use ripple drawable or ?attr/selectableItemBackground for interactive views; define mask layer for custom bounded ripple,Set custom background without ripple on clickable views; use setOnTouchListener for manual highlight; no touch feedback,"<!-- Custom ripple: --> <ripple xmlns:android='http://schemas.android.com/apk/res/android' android:color='?attr/colorControlHighlight'><item android:id='@android:id/mask'><shape android:shape='rectangle'><solid android:color='#FFFFFF' /><corners android:radius='12dp' /></shape></item><item><shape android:shape='rectangle'><solid android:color='@color/surface' /><corners android:radius='12dp' /></shape></item></ripple>; // Or simple: android:foreground='?attr/selectableItemBackground'","<Button android:background='@color/primary' /> // no ripple feedback; // Or: view.setOnTouchListener { v, event -> when (event.action) { ACTION_DOWN -> v.alpha = 0.5f; ACTION_UP -> v.alpha = 1f }; false } // janky; no ripple; accessibility issues; wrong approach",Medium,https://developer.android.com/guide/topics/resources/drawable-resource#RippleDrawable
XML Views,Shape Drawable with Gradient,"Use shape drawable with gradient element for smooth color transitions in backgrounds. Supports linear radial and sweep gradient types. Combine with corners element for rounded gradient backgrounds. Use angle attribute (must be multiple of 45) for linear gradient direction. Prefer XML gradients over programmatic GradientDrawable for reusability.",Define shape drawables with gradient in res/drawable/; use angle for direction; type for linear|radial|sweep; combine with corners and stroke,Create GradientDrawable programmatically for backgrounds that could be XML resources; hardcode gradient colors in code,"<!-- res/drawable/gradient_background.xml --> <shape xmlns:android='http://schemas.android.com/apk/res/android' android:shape='rectangle'><gradient android:startColor='@color/primary' android:centerColor='@color/primary_variant' android:endColor='@color/secondary' android:angle='135' android:type='linear' /><corners android:radius='16dp' /></shape>; <View android:background='@drawable/gradient_background' />","// Programmatic: val gradient = GradientDrawable(GradientDrawable.Orientation.TL_BR, intArrayOf(Color.parseColor('#6200EE'), Color.parseColor('#03DAC5'))); gradient.cornerRadius = 16f.dp; view.background = gradient // not reusable; hardcoded colors; can't reference in XML; duplicated across views",Low,https://developer.android.com/guide/topics/resources/drawable-resource#Shape
XML Views,Rotate and Animated-Rotate Drawables,"Use rotate drawable to apply fixed rotation to a drawable resource. Use animated-rotate for continuous rotation animation (loading spinners). The rotate drawable transforms at draw time without creating new bitmaps. Combine with vector drawables for resolution-independent rotating icons.",Use rotate/animated-rotate in res/drawable/ XML; set pivotX/Y to 50% for center rotation; fromDegrees/toDegrees for range; combine with vector drawables,Create ObjectAnimator on view rotation in code for simple spin effects; use GIF for loading spinners instead of XML rotation,"<!-- Loading spinner: res/drawable/spinning_loader.xml --> <animated-rotate xmlns:android='http://schemas.android.com/apk/res/android' android:drawable='@drawable/ic_loading' android:pivotX='50%' android:pivotY='50%' />; <!-- Fixed rotation: --> <rotate xmlns:android='http://schemas.android.com/apk/res/android' android:drawable='@drawable/ic_arrow' android:fromDegrees='0' android:toDegrees='180' android:pivotX='50%' android:pivotY='50%' />; <ProgressBar android:indeterminateDrawable='@drawable/spinning_loader' />","// Programmatic: val rotateAnim = ObjectAnimator.ofFloat(imageView, 'rotation', 0f, 360f); rotateAnim.repeatCount = INFINITE; rotateAnim.duration = 1000; rotateAnim.start() // needs manual lifecycle management; view reference leak risk; not reusable across layouts",Low,https://developer.android.com/guide/topics/resources/drawable-resource#Rotate
XML Views,Popup Menu XML,"Use PopupMenu with menu XML resource for contextual overflow actions anchored to a specific view. Define menu items in res/menu/ with icon title and showAsAction attributes. PopupMenu handles inflation positioning and dismissal automatically. Always handle click events via setOnMenuItemClickListener.",Define menu XML in res/menu/; inflate via PopupMenu; anchor to trigger view; handle clicks via setOnMenuItemClickListener,Build popup with custom AlertDialog or ListPopupWindow for simple menu scenarios; hardcode menu items in code,"<!-- res/menu/item_actions.xml --> <menu xmlns:android='http://schemas.android.com/apk/res/android'><item android:id='@+id/edit' android:icon='@drawable/ic_edit' android:title='@string/edit' /><item android:id='@+id/delete' android:icon='@drawable/ic_delete' android:title='@string/delete' /><item android:id='@+id/share' android:icon='@drawable/ic_share' android:title='@string/share' /></menu>; // Kotlin: val popup = PopupMenu(context, anchorView); popup.inflate(R.menu.item_actions); popup.setOnMenuItemClickListener { item -> when (item.itemId) { R.id.edit -> { editItem(); true }; R.id.delete -> { deleteItem(); true }; else -> false } }; popup.show()","// Custom dialog as menu: AlertDialog.Builder(context).setItems(arrayOf('Edit', 'Delete', 'Share')) { _, which -> when (which) { 0 -> edit(); 1 -> delete(); 2 -> share() } }.show() // no icons; no Material styling; not a proper popup; hardcoded strings; not anchored to view",Medium,https://developer.android.com/develop/ui/views/components/menus#PopupMenu
XML Views,Contextual Action Bar with Menu XML,"Use ActionMode with menu XML for contextual actions on selected items (multi-select delete share etc). ActionMode replaces the app bar temporarily showing contextual actions. Implement ActionMode.Callback to inflate menu handle clicks and clean up. Trigger via startActionMode on long press or selection change.",Implement ActionMode.Callback; inflate menu XML in onCreateActionMode; handle items in onActionItemClicked; finish ActionMode when done,Use custom toolbar that you show/hide manually for selection mode; or AlertDialog for batch actions,"// ActionMode.Callback: private val actionModeCallback = object : ActionMode.Callback { override fun onCreateActionMode(mode: ActionMode, menu: Menu): Boolean { mode.menuInflater.inflate(R.menu.contextual_actions, menu); mode.title = '1 selected'; return true }; override fun onActionItemClicked(mode: ActionMode, item: MenuItem): Boolean { return when (item.itemId) { R.id.action_delete -> { deleteSelected(); mode.finish(); true }; R.id.action_share -> { shareSelected(); mode.finish(); true }; else -> false } }; override fun onDestroyActionMode(mode: ActionMode) { clearSelection(); actionMode = null } }; // Start: actionMode = startSupportActionMode(actionModeCallback)","// Manual selection toolbar: selectionToolbar.visibility = if (selectedCount > 0) VISIBLE else GONE; mainToolbar.visibility = if (selectedCount > 0) GONE else VISIBLE // manual state management; animation issues; doesn't integrate with system back; complex lifecycle handling",Medium,https://developer.android.com/develop/ui/views/components/menus#CAB
XML Views,Bottom Navigation with Menu XML,"Define BottomNavigationView items via menu XML resource. Each menu item becomes a navigation tab with icon and label. Integrate with Navigation Component using setupWithNavController for automatic destination switching and selection state. Limit to 3-5 items per Material guidelines.",Define menu XML with 3-5 items; setupWithNavController for Navigation integration; use icon and title on each item,Create custom LinearLayout with ImageButtons for bottom navigation; more than 5 tabs; no Navigation integration,"<!-- res/menu/bottom_nav_menu.xml --> <menu xmlns:android='http://schemas.android.com/apk/res/android'><item android:id='@+id/homeFragment' android:icon='@drawable/ic_home' android:title='@string/home' /><item android:id='@+id/searchFragment' android:icon='@drawable/ic_search' android:title='@string/search' /><item android:id='@+id/profileFragment' android:icon='@drawable/ic_profile' android:title='@string/profile' /></menu>; // XML: <com.google.android.material.bottomnavigation.BottomNavigationView android:id='@+id/bottom_nav' app:menu='@menu/bottom_nav_menu' />; // Setup: bottomNav.setupWithNavController(navController)","// Custom bottom bar: <LinearLayout android:orientation='horizontal'><ImageButton android:src='@drawable/ic_home' android:onClick='goHome' /><ImageButton android:src='@drawable/ic_search' android:onClick='goSearch' /></LinearLayout> // no selection state; no badges; no Material styling; no label; not accessible; manual navigation",High,https://developer.android.com/develop/ui/views/components/menus
XML Views,PreferenceFragmentCompat Settings Screen,"Use PreferenceFragmentCompat with Preference XML to build settings screens. Define preference hierarchy in res/xml/preferences.xml with PreferenceScreen as root. PreferenceFragmentCompat handles UI rendering persistence to SharedPreferences and change callbacks automatically. Use PreferenceCategory for grouping.",Use PreferenceFragmentCompat; define hierarchy in res/xml/; unique key per preference; use categories for grouping; listen via OnPreferenceChangeListener,Build settings with custom RecyclerView adapter; manual SharedPreferences reads/writes for each setting; custom toggle views,"<!-- res/xml/settings.xml --> <PreferenceScreen xmlns:app='http://schemas.android.com/apk/res-auto'><PreferenceCategory app:title='@string/notifications_category'><SwitchPreferenceCompat app:key='notifications_enabled' app:title='@string/enable_notifications' app:summary='@string/notifications_summary' app:defaultValue='true' /><ListPreference app:key='notification_frequency' app:title='@string/frequency' app:entries='@array/frequency_labels' app:entryValues='@array/frequency_values' app:defaultValue='daily' /></PreferenceCategory></PreferenceScreen>; // Fragment: class SettingsFragment : PreferenceFragmentCompat() { override fun onCreatePreferences(saved: Bundle?, rootKey: String?) { setPreferencesFromResource(R.xml.settings, rootKey) } }","// Custom settings: class SettingsActivity : AppCompatActivity() { override fun onCreate(saved: Bundle?) { val switch = findViewById<Switch>(R.id.notif_switch); switch.isChecked = prefs.getBoolean('notifications', true); switch.setOnCheckedChangeListener { _, checked -> prefs.edit().putBoolean('notifications', checked).apply() } } } // manual for every setting; inconsistent UI; no grouping; boilerplate",Medium,https://developer.android.com/develop/ui/views/components/settings
XML Views,Shared Element Transitions,"Use shared element transitions to create visual continuity between screens by animating a shared view (image card title) from one Fragment/Activity to another. Define transitionName on shared views in both layouts. Use FragmentTransaction.addSharedElement or ActivityOptions.makeSceneTransitionAnimation. Combine with ChangeBounds and ChangeTransform.",Set android:transitionName on shared views in both layouts; use addSharedElement in FragmentTransaction; postponeEnterTransition until image loaded,Recreate views without transition animation; use fragment replace with no shared elements; hardcoded fade-only transitions,"<!-- list_item.xml --> <ImageView android:id='@+id/itemImage' android:transitionName='item_image_{id}' />; <!-- detail_fragment.xml --> <ImageView android:id='@+id/heroImage' android:transitionName='item_image_{id}' />; // Navigate: parentFragmentManager.commit { setReorderingAllowed(true); addSharedElement(imageView, 'item_image_42'); replace(R.id.container, DetailFragment()); addToBackStack(null) }; // Detail Fragment: override fun onCreate(saved: Bundle?) { sharedElementEnterTransition = TransitionInflater.from(requireContext()).inflateTransition(android.R.transition.move); postponeEnterTransition(); }; // After image loaded: startPostponedEnterTransition()","// No transition: parentFragmentManager.commit { replace(R.id.container, DetailFragment()) } // abrupt screen change; no visual continuity; poor UX; // Or: overridePendingTransition(R.anim.fade_in, R.anim.fade_out) // generic; image appears in new position without animation",Medium,https://developer.android.com/develop/ui/views/animations/transitions/start-activity
XML Views,Scene Transitions with TransitionManager,"Use TransitionManager with Scene objects for animated layout changes within a single screen. Define start and end layouts as separate XML files. TransitionManager.go() animates between scenes. Use beginDelayedTransition for in-place modifications without predefined scenes. Combine transitions with TransitionSet for complex effects.",Use TransitionManager.go(scene transition) for predefined layouts; beginDelayedTransition for in-place changes; TransitionSet for combined effects,Set view visibility and properties directly without animation; use ObjectAnimator chains for layout changes that TransitionManager handles better,"// Scene transition: val sceneRoot = findViewById<ViewGroup>(R.id.scene_root); val collapsedScene = Scene.getSceneForLayout(sceneRoot, R.layout.scene_collapsed, this); val expandedScene = Scene.getSceneForLayout(sceneRoot, R.layout.scene_expanded, this); val transition = TransitionSet().addTransition(ChangeBounds()).addTransition(Fade()).setDuration(300); TransitionManager.go(expandedScene, transition); // Delayed transition: TransitionManager.beginDelayedTransition(container, AutoTransition()); view.visibility = View.GONE // animates automatically","// No animation: view.visibility = View.GONE // abrupt; // Manual animation: ValueAnimator.ofInt(view.height, 0).apply { addUpdateListener { view.layoutParams.height = it.animatedValue as Int; view.requestLayout() } }.start() // complex; manual layout invalidation; doesn't handle other views moving",Medium,https://developer.android.com/develop/ui/views/animations/transitions
XML Views,TextInputLayout Error Handling,"Use TextInputLayout setError for inline validation with error messages that appear below the input field. Enable setErrorEnabled(true) before setting errors. Use setErrorIconDrawable for custom error icons. Pair with helper text for guidance. Error state automatically tints the border and label red following Material guidelines.",setErrorEnabled(true); setError(message) for validation; clear with setError(null); combine with helper text and character counter,Use Toast or Snackbar for form validation errors; manually color EditText border on error; custom error TextViews below each field,"<com.google.android.material.textfield.TextInputLayout android:id='@+id/emailLayout' android:layout_width='match_parent' android:layout_height='wrap_content' android:hint='@string/email' app:errorEnabled='true' app:helperText='@string/email_helper' app:helperTextEnabled='true' style='@style/Widget.Material3.TextInputLayout.OutlinedBox'><com.google.android.material.textfield.TextInputEditText android:layout_width='match_parent' android:layout_height='wrap_content' android:inputType='textEmailAddress' /></com.google.android.material.textfield.TextInputLayout>; // Validate: if (!isValidEmail(text)) { emailLayout.error = getString(R.string.invalid_email) } else { emailLayout.error = null }","// Toast for validation: if (!isValid) Toast.makeText(this, 'Invalid email', LENGTH_SHORT).show() // not inline; disappears; no visual connection to field; // Manual: emailEditText.setBackgroundTintList(ColorStateList.valueOf(Color.RED)) // doesn't show message; manual reset needed; not Material compliant",High,https://developer.android.com/reference/com/google/android/material/textfield/TextInputLayout
XML Views,TextInputLayout Character Counter,"Enable character counter on TextInputLayout to show current/max character count below the input. The counter automatically turns error color when the limit is exceeded. Combine with counterMaxLength for enforcement. Use for fields with length restrictions like usernames bios tweets.",Set app:counterEnabled='true' and app:counterMaxLength; counter auto-updates and shows error color on overflow,Implement custom TextWatcher to count characters and update a separate TextView; no visible limit indicator,"<com.google.android.material.textfield.TextInputLayout android:layout_width='match_parent' android:layout_height='wrap_content' android:hint='@string/bio' app:counterEnabled='true' app:counterMaxLength='280' app:counterOverflowTextAppearance='@style/CounterOverflow' style='@style/Widget.Material3.TextInputLayout.OutlinedBox'><com.google.android.material.textfield.TextInputEditText android:layout_width='match_parent' android:layout_height='wrap_content' android:inputType='textMultiLine' android:maxLines='4' /></com.google.android.material.textfield.TextInputLayout>","// Manual counter: editText.addTextChangedListener(object : TextWatcher { override fun afterTextChanged(s: Editable) { counterText.text = '${s.length}/280'; if (s.length > 280) counterText.setTextColor(Color.RED) } }) // boilerplate; doesn't integrate with TextInputLayout error state; manual color management",Low,https://developer.android.com/reference/com/google/android/material/textfield/TextInputLayout
XML Views,TextInputLayout End Icon Modes,"Use TextInputLayout end icon modes for common input patterns: PASSWORD_TOGGLE for password visibility CLEAR_TEXT for clearable inputs DROPDOWN_MENU for AutoCompleteTextView and CUSTOM for app-specific actions. End icons are positioned consistently and handle accessibility automatically.",Set app:endIconMode for built-in modes; use END_ICON_CUSTOM with endIconDrawable and endIconContentDescription for custom actions,Manually add ImageButton inside TextInputLayout; create custom toggle for password visibility; manual clear button with TextWatcher,"<!-- Password toggle: --> <com.google.android.material.textfield.TextInputLayout app:endIconMode='passwordToggle' android:hint='@string/password'><com.google.android.material.textfield.TextInputEditText android:inputType='textPassword' /></com.google.android.material.textfield.TextInputLayout>; <!-- Clear text: --> <com.google.android.material.textfield.TextInputLayout app:endIconMode='clear_text' android:hint='@string/search'><com.google.android.material.textfield.TextInputEditText /></com.google.android.material.textfield.TextInputLayout>; <!-- Dropdown: --> <com.google.android.material.textfield.TextInputLayout app:endIconMode='dropdown_menu' android:hint='@string/category'><AutoCompleteTextView android:layout_width='match_parent' android:layout_height='wrap_content' /></com.google.android.material.textfield.TextInputLayout>","// Manual password toggle: <LinearLayout><EditText android:inputType='textPassword' /><ImageButton android:src='@drawable/ic_visibility' android:onClick='togglePasswordVisibility' /></LinearLayout> // not accessible; manual state management; not inside TextInputLayout; inconsistent positioning",Medium,https://developer.android.com/reference/com/google/android/material/textfield/TextInputLayout
