Category,Issue,Platform,Severity,Keywords,Description,Do,Dont,Code Good,Code Bad,Metric,Reference URL
Security,SQL Injection Prevention,Android,Critical,"sql injection room parameterized query rawQuery","Using string concatenation for SQL queries","Use Room with @Query or SQLite parameterized queries with ?","Concatenate user input directly into SQL strings","@Query('SELECT * FROM users WHERE id = :userId') fun getUser(userId: String); // Or: db.query('users', null, 'id = ?', arrayOf(userId), null)","db.rawQuery('SELECT * FROM users WHERE name = $userInput') // SQL injection vulnerable",Query safe,https://developer.android.com/training/data-storage/room/accessing-data
Security,Input Validation,Android,High,"input validation sanitize regex whitelist","Accepting untrusted input without validation","Validate and sanitize all inputs with regex whitelisting length checks","Trust all user input without validation","val email = input.takeIf { it.matches(Regex('[a-zA-Z0-9._%+-]+@[a-zA-Z0-9.-]+\\.[a-zA-Z]{2,}')) } ?: throw IllegalArgumentException('Invalid email')","val userId = intent.getStringExtra('user_id'); deleteUser(userId) // No validation - injection risk",Inputs validated,https://developer.android.com/privacy-and-security/security-tips#input-validation
Security,Hardcoded Credentials,Android,Critical,"hardcoded credentials api key password secret buildconfig","API keys passwords secrets hardcoded in source code","Use Android Keystore BuildConfig secrets-gradle-plugin; never commit secrets to git","Hardcode API keys passwords in source code or BuildConfig","// secrets.properties (gitignored): API_KEY=xyz; // build.gradle.kts: secrets { propertiesFileName = 'secrets.properties' }; // Access: BuildConfig.API_KEY; // Or: KeyStore for runtime secrets","const val API_KEY = 'sk_live_1234567890abcdef'; // EXPOSED in decompiled APK; // Or: buildConfigField 'String' 'API_KEY' '\"secret\"' // Committed to git",Secrets leaked,https://developer.android.com/privacy-and-security/security-tips
Security,Third-Party SDK Risks,Android,High,"third party sdk supply chain dependency vulnerability","Untrusted or outdated third-party libraries introducing vulnerabilities","Vet all SDKs; use dependency scanning; keep libraries updated; read SDK privacy policies","Use outdated or unverified third-party libraries without security review","// build.gradle.kts: dependencies { implementation('com.trusted:library:2.1.0') // Latest verified version }; // Scan: ./gradlew dependencyCheckAnalyze; // Review SDK data collection in Data Safety section","dependencies { implementation('com.unknown:sdk:1.0.0') } // Outdated malicious unknown; // No dependency scanning or privacy review",Supply chain attack,https://developer.android.com/privacy-and-security/risks
Security,Insecure App Signing,Android,Critical,"app signing keystore jks release security","Weak keystore management or exposed signing keys","Use strong keystore passwords; store in CI environment variables; never commit keystores","Commit keystore to git; use weak passwords; share keystore files","// CI environment variables: KEYSTORE_PASSWORD KEYSTORE_KEY_PASSWORD; signingConfigs { release { storeFile = file(System.getenv('KEYSTORE_PATH')); storePassword = System.getenv('KEYSTORE_PASSWORD') } }",".gitignore without *.jks; // keystore.jks committed to repository; // password='android123' in gradle.properties also committed",Keys compromised,https://developer.android.com/studio/publish/app-signing
Security,Debug Code in Production,Android,High,"debug code production release leak deobfuscate logging","Debug features left enabled in production builds","Remove all debug code with BuildConfig.DEBUG checks; strip logs with R8; disable debugging","Ship production APK with debug features enabled or debuggable=true","if (BuildConfig.DEBUG) { enableDebugMenu(); Log.d(TAG 'Debug info') }; // AndroidManifest.xml: android:debuggable='false'; // R8 strips debug code in release","<application android:debuggable='true'> // NEVER in production; enableDebugMenu(); // Always enabled exposing admin features; Log.d() without BuildConfig check",App debuggable,https://developer.android.com/studio/debug
Security,Excessive Data Collection,Android,High,"excessive data collection privacy gdpr ccpa google play","Collecting unnecessary user data violating privacy policies","Collect only essential data; declare in Data Safety; follow GDPR/CCPA; minimize permissions","Collect all available data without user consent or disclosure","// Minimal collection: val essentialData = UserData(userId username); // Data Safety declaration in Play Console; requestPermissions(ESSENTIAL_PERMISSIONS)","// Collect everything: deviceId contacts location callLogs sms; // No Data Safety declaration; // No privacy policy; // Violates Play Store policies",Policy violation,https://developer.android.com/privacy-and-security/privacy-controls
