Category,Threat,Platform,Severity,Keywords,Description,Mitigation,Code Good,Code Bad,OWASP Ref,Reference URL
Network,No Certificate Pinning,All,High,"certificate pinning ssl tls mitm man middle attack https",Not using certificate pinning allowing MITM attacks,Implement certificate/public key pinning with backup pins; use network security config,NetworkSecurityConfig with <pin-set>; CertificatePinner with backup pins,No pinning; trust all system CAs; vulnerable to MITM,M3 - Insecure Communication,https://developer.android.com/privacy-and-security/security-config
Network,Certificate Pinning Bypass Risk,All,Medium,"certificate pinning bypass rotation management expiry backup",Certificate pinning without backup pins causing outages,Include backup pins; automate cert lifecycle; monitor expiry; public key pinning,Pin public keys not certs; 2+ backup pins; automated monitoring alerts,Single cert pin; no backup; no monitoring; leads to app outages,M3 - Insecure Communication,
Clipboard,Clipboard Data Exposure,All,High,"clipboard sensitive password copy paste hijacking steal",Allowing sensitive data to be copied to clipboard,Prevent clipboard for sensitive fields; clear clipboard automatically; detect access,textInputType=TYPE_TEXT_VARIATION_PASSWORD prevents copy; auto-clear clipboard,Allow copy of passwords credit cards SSNs to clipboard,M2 - Insecure Data Storage,https://developer.android.com/develop/ui/views/touch-and-input/copy-paste
Clipboard,Clipboard Hijacking,All,Medium,"clipboard hijacking malware replace crypto wallet address attack",Clipboard content manipulated by malicious apps,Warn users about clipboard risks; validate pasted data; use secure input methods,Validate pasted crypto addresses; warn on sensitive paste; use autofill,No validation of clipboard content allows malware replacement,M1 - Improper Platform Usage,
API,OAuth 2.1 Token Security,All,Critical,"oauth 2.1 pkce token refresh access api authentication authorization",Not using OAuth 2.1 PKCE and secure token handling,Implement OAuth 2.1 with mandatory PKCE; short-lived tokens; secure storage; rotation,Use PKCE for all flows; store tokens in Keychain/Keystore; rotate refresh tokens,OAuth 2.0 implicit flow; long-lived tokens; SharedPreferences storage,M4 - Insecure Authentication,https://oauth.net/2.1/
API,API Token Exposure,All,Critical,"api key token hardcoded secret exposed public repository leak",Hardcoded API keys or tokens in source code,Never hardcode API keys; use secure config; rotate keys; detect leaks in CI/CD,Store in BuildConfig from secrets.properties; rotate monthly; scan with TruffleHog,Hardcoded API_KEY = 'sk_live_abc123' in source code,M2 - Insecure Data Storage,
Code,NDK API Key Storage,Android,Medium,"ndk native code jni cmake api key hide reverse engineering c++",Storing API keys in plain Java/Kotlin code easily decompiled,Store sensitive keys in NDK C++ code with obfuscation; use JNI bridge,Store keys in native .so with XOR encryption; strip symbols; use extern C JNI,API_KEY = 'sk_12345' in BuildConfig or strings.xml,M2 - Insecure Data Storage,
Code,Native Code Obfuscation,Android,High,"native code obfuscation ndk llvm symbol strip so binary",Native .so libraries with readable symbols and plain strings,Obfuscate native code; strip symbols; encrypt strings at compile time,Use -fvisibility=hidden; strip --strip-all; XOR encrypt strings in C++,Readable function names API keys in .so easily extracted with strings command,M7 - Client Code Quality,
Code,No Code Obfuscation,All,High,"obfuscation proguard r8 dexguard minify shrink decompile",App published without code obfuscation vulnerable to reverse engineering,Enable R8/ProGuard minification obfuscation; use DexGuard for critical apps,minifyEnabled=true; proguardFiles; shrinkResources=true; DexGuard for banking apps,Release APK with readable class/method names easily decompiled with jadx,M7 - Client Code Quality,https://developer.android.com/build/shrink-code
Code,Insufficient Obfuscation,All,Medium,"r8 proguard rules keep class prevent obfuscation weak",R8/ProGuard rules that keep too many classes preventing obfuscation,-keep rules only for essential classes; allow aggressive obfuscation,Minimize -keep rules; avoid -keep class ** wildcards; obfuscate models POJOs,-keep class * prevents all obfuscation; defeating purpose,M7 - Client Code Quality,
Code,No Anti-Tampering,All,Critical,"tampering signature verification integrity check modify repackage",App doesn't detect code modifications or repackaging,Implement signature verification; checksum validation; detect repackaging,Verify app signature at runtime; detect modified APK; validate DEX integrity,No checks allow attackers to modify inject malicious code and repackage,M8 - Code Tampering,
Code,No Root Detection,All,High,"root detection magisk rooted device jailbreak su binary superuser",App runs on rooted/jailbroken devices without restriction,Detect root/jailbreak; use Play Integrity API; restrict on compromised devices,Check for su binary Magisk SafetyNet bypass; use Play Integrity API Standard verdict,Banking app runs normally on rooted Magisk device with Xposed,M1 - Improper Platform Usage,https://developer.android.com/google/play/integrity
Code,Play Integrity API Missing,Android,Critical,"play integrity api safetynet device integrity app license verdict",Not using Play Integrity API for device/app integrity verification,Implement Play Integrity API with server-side token validation,Request integrity token; send to backend; validate device/app/license verdicts server-side,No device integrity checks allow modified apps on compromised devices,M1 - Improper Platform Usage,https://developer.android.com/google/play/integrity
Code,No Frida Detection,All,High,"frida detection hook runtime manipulation debugger xposed lsposed",App vulnerable to Frida hooking and runtime manipulation,Detect Frida Xposed frameworks; anti-debug; check for suspicious libs,Detect frida-server process; check loaded libs for frida; ptrace anti-debug,No detection allows Frida to bypass all security checks certificate pinning,M8 - Code Tampering,
Code,No Debugger Detection,All,Medium,"debugger detection debug anti-debug android:debuggable ptrace",App allows debugging in production enabling runtime attacks,Disable android:debuggable; detect debuggers at runtime; anti-ptrace,Check android.os.Debug.isDebuggerConnected(); ptrace self-protection; exit if debugged,android:debuggable=true in release OR no runtime debugger detection,M8 - Code Tampering,
Code,No Emulator Detection,All,Medium,"emulator detection android emulator genymotion virtual device automation",App runs on emulators enabling automated attacks and analysis,Detect emulator/virtual environments; restrict on non-real devices,Check Build.FINGERPRINT Build.MODEL for emulator; detect Genymotion; restrict features,Banking app fully functional in Android Studio emulator with Burp proxy,M1 - Improper Platform Usage,
Code,CMake NDK API Key Setup,Android,High,"cmake ndk api key native library jni c++ cmakelists externalNativeBuild",No CMake/NDK setup for native API key storage; keys in Kotlin/Java easily decompiled,Configure CMake with externalNativeBuild; create native-lib.cpp with JNI bridge; load .so at runtime,CMakeLists.txt add_library(native-lib SHARED); System.loadLibrary('native-lib'); extern C JNIEXPORT,Store API_KEY in BuildConfig strings.xml or Kotlin companion object,M2 - Insecure Data Storage,https://developer.android.com/ndk/guides/cmake
Code,NDK Key Splitting and Encoding,Android,High,"ndk key split xor encode runtime assembly obfuscate native c++",Storing API key as single plain string in native code; extractable with strings command,Split key into multiple parts; XOR encode with runtime mask; assemble only when needed; zero memory after use,Split key into 3+ char arrays; XOR with device-derived salt; assemble in JNI call; memset zero after,Single const char* apiKey = 'sk_live_abc123' in native .cpp file,M2 - Insecure Data Storage,https://blog.mindorks.com/securing-api-keys-using-android-ndk/
Code,Secrets Gradle Plugin,Android,Medium,"secrets gradle plugin local.properties buildconfig api key google maps",API keys committed to version control or hardcoded in build.gradle,Use Google secrets-gradle-plugin to inject keys from local.properties into BuildConfig at build time,id('com.google.android.libraries.mapsplatform.secrets-gradle-plugin'); secrets.properties gitignored,API_KEY = 'abc123' hardcoded in build.gradle.kts or committed to git,M2 - Insecure Data Storage,https://github.com/google/secrets-gradle-plugin
API,Backend API Key Proxy,All,Critical,"backend proxy api key server side relay never store client mobile",Storing third-party API keys (payment; maps; AI) directly in mobile app,Proxy all third-party API calls through your backend; store keys server-side only; authenticate client,Mobile calls your backend; backend adds API key server-side; never expose key to client,Mobile app directly calls OpenAI/Stripe/Maps API with embedded key,M2 - Insecure Data Storage,
API,API Key Restriction,All,High,"api key restriction scope package sha256 ip referrer quota limit",API keys used without platform restrictions allowing abuse if leaked,Restrict API keys by package name; SHA-256 fingerprint; IP allowlist; API scope; usage quota,Restrict Google API key to com.myapp + SHA-256 cert; set daily quota; scope to Maps SDK only,Unrestricted API key works from any app any IP any API,M2 - Insecure Data Storage,https://cloud.google.com/docs/authentication/api-keys#securing_an_api_key
Code,Flutter Code Obfuscation,Flutter,High,"flutter obfuscate dart split-debug-info aot reverse engineering symbol",Flutter release build with readable Dart symbols and class names,Use --obfuscate with --split-debug-info; store symbol map securely for crash reporting,flutter build apk --release --obfuscate --split-debug-info=build/symbols; upload symbols to Crashlytics,flutter build apk --release without obfuscation; readable Dart class names in APK,M9 - Reverse Engineering,https://docs.flutter.dev/deployment/obfuscate
Code,iOS Binary Protection,iOS,High,"ios obfuscation swiftshield swift binary protection fairplay bitcode strip",iOS app with readable Swift class/method names after FairPlay decryption,Use SwiftShield for identifier obfuscation; strip symbols; enable bitcode; encrypt sensitive strings,SwiftShield obfuscation; strip -S -x in build settings; encrypt string literals at compile time,Readable class/method names in decrypted binary; dump with class-dump or Hopper,M9 - Reverse Engineering,https://github.com/rockbruno/swiftshield
Code,React Native Code Protection,React Native,High,"react native hermes bytecode obfuscation javascript bundle jsbundle metro",React Native JS bundle easily readable; business logic exposed,Enable Hermes for bytecode compilation; add JS obfuscation; use react-native-obfuscating-transformer,Enable Hermes in app.json; use metro obfuscation plugin; ProGuard for Android native layer,Plain JavaScript bundle in APK/IPA; readable with any text editor,M9 - Reverse Engineering,https://reactnative.dev/docs/hermes
Code,String Encryption,All,High,"string encryption sensitive literal compile time encrypt decrypt runtime",Sensitive strings (URLs; tokens; keys) stored as plain text literals in binary,Encrypt strings at compile time; decrypt at runtime only when needed; zero memory after use,Use compile-time string encryption macro/annotation; decrypt via secure function; clear from memory,Plain string literals 'https://api.secret.com/v1' readable in decompiled binary,M9 - Reverse Engineering,
Code,Resource Obfuscation,Android,Medium,"resource obfuscation resguard arsc shrink resource name mapping",Android resource names (layouts; drawables; strings) reveal app structure,Use resource shrinking; ResGuard for resource name obfuscation; remove unused resources,shrinkResources=true; use ResGuard or AndResGuard to rename res/ entries; remove debug resources,Readable resource names like activity_payment.xml; ic_credit_card.png reveal structure,M9 - Reverse Engineering,https://github.com/nicolo-dev/ResGuard
Code,RASP Implementation,All,Critical,"rasp runtime application self-protection talsec freerasp guardsquare promon",No runtime protection; app vulnerable to live attacks after installation,Implement RASP SDK for real-time threat detection; respond to root; hook; tamper; debugger,Integrate freeRASP/Talsec; configure threat callbacks; block or warn on root; hook; repackage; debugger,No runtime monitoring; attacker freely hooks functions modifies memory at runtime,M8 - Code Tampering,https://github.com/talsec/Free-RASP-Android
Code,Memory Dump Protection,All,High,"memory dump protection sensitive data ram scraping process dump anti-dump",Sensitive data (keys; tokens; passwords) persists in memory; extractable via dump,Zero-fill sensitive data after use; use secure memory allocations; detect memory dump attempts,memset(buffer 0 len) after use; overwrite String with char[]; detect /proc/self/mem access,Passwords API keys remain in heap memory indefinitely; extractable with memory dump tools,M2 - Insecure Data Storage,
Code,Hook Detection General,All,High,"hook detection substrate xposed lsposed cydia substrate method swizzle frida",App vulnerable to method hooking via Xposed; LSPosed; Substrate; Frida,Detect known hooking frameworks; verify method integrity; check loaded libraries at runtime,Check for Xposed/LSPosed modules; detect Substrate; verify native method pointers; scan /proc/maps,No hook detection; Xposed module freely intercepts login() bypassing all checks,M8 - Code Tampering,
Code,APK Signature Verification,Android,High,"apk signature scheme v2 v3 v4 verification signing certificate runtime check",Not verifying APK signature at runtime allowing repackaged APK distribution,Verify APK signing certificate at runtime; use signature scheme v3+; check package signature hash,PackageManager.getPackageInfo(GET_SIGNING_CERTIFICATES); compare SHA-256 with known cert hash,No runtime signature check; attacker repackages APK with different cert; distributes modified app,M8 - Code Tampering,https://developer.android.com/about/versions/13/features#apk-signature-scheme
Code,DEX Integrity Verification,Android,High,"dex integrity verification checksum crc classes.dex tamper modification",No DEX file integrity check allowing code injection via modified classes.dex,Compute and verify DEX file checksums at runtime; compare against known-good values,Calculate CRC32/SHA-256 of classes.dex at runtime; compare with embedded expected hash; abort if mismatch,No DEX verification; attacker modifies classes.dex injects malicious code repackages APK,M8 - Code Tampering,
Code,Anti-Dynamic Analysis,All,High,"dynamic analysis prevention timing check debugger trace strace ltrace",App does not detect dynamic analysis tools used during reverse engineering,Detect tracing tools; timing anomalies; instrumentation frameworks; suspicious process names,Detect strace/ltrace via /proc/self/status TracerPid; timing checks for breakpoints; scan process list,No dynamic analysis detection; attacker freely traces API calls and function parameters,M8 - Code Tampering,
Code,SSL Unpinning Detection,All,High,"ssl unpinning detection bypass certificate pinning frida objection",Certificate pinning bypassed by Frida/Objection scripts without app awareness,Detect SSL pinning bypass attempts; verify pinning at multiple layers; implement custom TrustManager checks,Verify cert chain integrity in custom TrustManager; detect Frida ssl_pinning_bypass.js; multi-layer pinning,Single-layer cert pinning easily bypassed with one Frida script; no bypass detection,M3 - Insecure Communication,
Code,DexGuard iXGuard Commercial,All,High,"dexguard ixguard guardsquare commercial obfuscation encryption protection",Basic R8/ProGuard insufficient for high-security apps (banking; fintech; healthcare),Use DexGuard (Android) or iXGuard (iOS/Flutter) for advanced obfuscation; string encryption; RASP,DexGuard: control flow obfuscation; string encryption; asset encryption; class encryption; RASP,Basic R8 minification only for banking app; no string encryption or control flow obfuscation,M9 - Reverse Engineering,https://www.guardsquare.com/dexguard
Code,ProGuard R8 Optimization,Android,High,"proguard r8 rules optimization shrink minify obfuscate android release",R8/ProGuard not configured or using default rules with poor coverage,Configure aggressive R8 rules; enable full mode; add custom rules for reflection/serialization only,isMinifyEnabled=true; isShrinkResources=true; proguardFiles with custom rules; R8 fullMode=true,isMinifyEnabled=false OR -keep class ** wildcard keeping everything unobfuscated,M9 - Reverse Engineering,https://developer.android.com/build/shrink-code
Code,iOS App Attest,iOS,High,"ios app attest devicecheck attestation integrity apple dcappattestservice",No server-side verification that requests come from genuine unmodified iOS app,Use App Attest API to generate hardware-backed attestation; validate assertions server-side,DCAppAttestService.shared.attestKey(); send attestation to server; validate receipt and assertion,No attestation; server trusts any HTTP client pretending to be the iOS app,M8 - Code Tampering,https://developer.apple.com/documentation/devicecheck/dcappattestservice
Network,Man-in-the-Middle Detection,All,High,"mitm detection proxy charles burp fiddler transparent proxy interception",App unaware of MITM proxy intercepting traffic during attacks,Detect proxy settings; verify direct connection; implement mutual TLS; detect transparent proxies,Check System.getProperty('http.proxyHost'); detect proxy via ConnectivityManager; mutual TLS auth,No proxy detection; attacker uses Charles/Burp to intercept all API traffic transparently,M3 - Insecure Communication,
