Category,Threat,Platform,Severity,Keywords,Description,Mitigation,Code Good,Code Bad,OWASP Ref,Reference URL
Cryptography,iOS CryptoKit AES-GCM Encryption,iOS,High,cryptokit aes-gcm symmetric encryption sealed box nonce authenticated ios swift,Using custom or weak encryption instead of Apple CryptoKit vetted implementations,Use CryptoKit AES.GCM for symmetric encryption; provides authenticated encryption with built-in nonce management,let sealedBox = try AES.GCM.seal(data using: key); let encrypted = sealedBox.combined!,CCCrypt(kCCEncrypt kCCAlgorithmAES data.count) // CommonCrypto manual IV; no authentication tag,M5 - Insufficient Cryptography,https://developer.apple.com/documentation/cryptokit/aes/gcm
Cryptography,iOS CryptoKit HKDF Key Derivation,iOS,High,cryptokit hkdf key derivation function password salt info symmetric key material ios,Deriving keys with weak methods like simple hashing instead of proper KDF,Use CryptoKit HKDF for key derivation with proper salt and info parameters,let derivedKey = HKDF<SHA256>.deriveKey(inputKeyMaterial: masterKey salt: salt info: info outputByteCount: 32),let key = SHA256.hash(data: password).withUnsafeBytes { Data($0) } // no salt; no KDF,M5 - Insufficient Cryptography,https://developer.apple.com/documentation/cryptokit/hkdf
Data Storage,iOS Keychain Error Recovery,iOS,High,keychain error handling errSecItemNotFound errSecDuplicateItem recovery migration corruption restore,Ignoring Keychain errors crashes or silently fails leaving users locked out,Handle all OSStatus codes; implement retry for transient errors; recovery flow for errSecItemNotFound,switch status { case errSecSuccess: break; case errSecDuplicateItem: SecItemUpdate(query update); default: reAuthenticate() },let _ = SecItemAdd(query nil) // ignore return status; crash on duplicate,M2 - Insecure Data Storage,https://developer.apple.com/documentation/security/keychain_services
Platform,iOS 18 Locked Hidden App Handling,iOS,Medium,ios 18 locked hidden app face id touch id passcode app visibility restriction developer,iOS 18 allows users to lock/hide apps; developers must handle restricted visibility,Design for locked/hidden state; ensure notifications work when hidden; test locked app behavior,Handle restricted state; notifications deliver silently when locked; content hidden from search,Assume app always visible; notifications expose sensitive content; crash when reopened from hidden,M1 - Improper Platform Usage,https://developer.apple.com/ios/
Platform,iOS USB Restricted Mode Awareness,iOS,Medium,ios usb restricted mode data transfer accessory lockdown forensic prevention,USB Restricted Mode disables data after 1 hour locked; apps relying on USB must handle disconnection,Handle accessory disconnection events; inform users; design for intermittent USB connectivity,EAAccessoryManager: handle .EAAccessoryDidDisconnect notification; graceful reconnection flow,Assume permanent USB connection; no disconnection handling; crash when accessory restricted,M1 - Improper Platform Usage,https://support.apple.com/en-us/102647
Privacy,iOS Granular Contact Access,iOS,High,ios 18 contacts granular access limited full selected contacts privacy CNContactStore authorization,iOS 18 allows users to share only selected contacts; apps assuming full access show incomplete data,Handle limited contact access; request only needed properties; re-prompt when contacts insufficient,CNContactStore requestAccess; handle .limited authorization; prompt user to share more if needed,Assume full contact access after grant; show empty state when limited; request all fields,M6 - Privacy Violation,https://developer.apple.com/documentation/contacts
Platform,iOS Managed App Configuration MDM,iOS,Medium,ios mdm managed app configuration UserDefaults managed appconfig enterprise provisioning,MDM config in UserDefaults accessible to app; sensitive enterprise config exposed if compromised,Read managed config; encrypt sensitive managed values; validate config integrity on load,UserDefaults dictionary(forKey: 'com.apple.configuration.managed'); validate; encrypt sensitive values,Store enterprise API keys in managed config without encryption; trust all managed values,M2 - Insecure Data Storage,https://developer.apple.com/documentation/devicemanagement
Platform,iOS App Clips Security Constraints,iOS,Medium,ios app clips nfc qr code limited sandbox ephemeral data sharing keychain group,App Clips run in restricted sandbox with limited Keychain; data deleted after inactivity,Use App Group for data passing; never store credentials in App Clip; verify invocation source,Validate invocation URL; share via App Group; prompt install for sensitive features,Store auth tokens in App Clip Keychain; rely on App Clip data persistence,M2 - Insecure Data Storage,https://developer.apple.com/documentation/app_clips
Data Storage,iOS Core Data Store Encryption,iOS,High,core data persistent store encryption sqlite file protection nsfileprotection ios database,Core Data SQLite store not encrypted by default; data readable on jailbroken devices,Apply NSPersistentStoreFileProtectionKey with .complete; use NSFileProtectionComplete,let options = [NSPersistentStoreFileProtectionKey: FileProtectionType.complete]; addPersistentStore(options:),NSPersistentContainer(name: 'Model').loadPersistentStores { _ in } // no protection,M2 - Insecure Data Storage,https://developer.apple.com/documentation/coredata
Network,iOS Network.framework TLS Configuration,iOS,High,network framework nwprotocoltls nwconnection tls 1.3 certificate pinning minimum version swift,URLSession without Network.framework TLS controls for fine-grained security,Use NWConnection for TLS control; set minimum TLS 1.3; configure pinning via sec_protocol_options,sec_protocol_options_set_min_tls_protocol_version(options .TLSv13),URLSession default TLS; no minimum version; accepts TLS 1.0,M3 - Insecure Communication,https://developer.apple.com/documentation/network
Platform,iOS App Extension Data Isolation,iOS,High,ios extension widget data isolation app group container keychain separate process sandbox,Extensions run in separate process; sharing requires App Group; extensions have limited capabilities,Use App Group for sharing; never store credentials in shared container; Keychain for secrets,UserDefaults(suiteName: 'group.com.app') for display data; secrets via Keychain shared group,Store auth tokens in App Group UserDefaults; share passwords via shared container,M2 - Insecure Data Storage,https://developer.apple.com/documentation/foundation/nsextensioncontext
Data Storage,iOS CloudKit Record ACL Security,iOS,High,cloudkit record security acl ckrecord private public shared zone database encryption,CloudKit public database accessible to any user; shared zones need careful ACL management,Use private database for sensitive data; CKShare with role-based access; validate ownership,CKContainer.default().privateCloudDatabase.save(record); CKShare .readWrite specific participants,CKContainer.default().publicCloudDatabase.save(sensitiveRecord) // public access,M2 - Insecure Data Storage,https://developer.apple.com/documentation/cloudkit
Privacy,iOS HealthKit Data Requirements,iOS,Critical,healthkit health data protection hipaa phi encryption authorization sensitive medical,HealthKit data contains sensitive medical information; improper handling violates privacy,Request only needed types; check authorization per type; never store externally without encryption,requestAuthorization(toShare: [] read: [heartRateType]); encrypt cached health data,requestAuthorization(toShare: allTypes read: allTypes); cache in UserDefaults,M6 - Privacy Violation,https://developer.apple.com/documentation/healthkit
Platform,iOS StoreKit Receipt Server Validation,iOS,High,storekit receipt validation server-side in-app purchase fraud prevention jailbreak bypass,Client-side receipt validation bypassable on jailbroken devices; fraud undetected,Validate receipts server-side; use StoreKit 2 JWS signed transactions; verify subscription,Transaction.currentEntitlements; send JWS to server; server verifies with Apple,Bundle.main.appStoreReceiptURL locally validated; jailbreak tweak grants unlimited purchases,M8 - Code Tampering,https://developer.apple.com/documentation/storekit
Code,iOS Swift Strict Concurrency Safety,iOS,High,swift concurrency sendable actor data race isolation strict checking compile time safety,Swift 6 strict concurrency prevents data races; apps without it risk race conditions,Enable strict concurrency; mark types Sendable; use actors for shared mutable state,actor SecureStorage { private var tokens: [String: String]; func getToken(_ key: String) -> String? },class TokenManager { var tokens: [String: String] = [:] } // mutable shared state; data race,M7 - Client Code Quality,https://developer.apple.com/documentation/swift/sendable
Network,iOS Certificate Transparency Monitoring,iOS,Medium,certificate transparency ct log sct signed timestamp tls certificate fraud detection,Not monitoring CT logs allows fraudulently issued certificates to go undetected,Monitor CT logs for unauthorized issuance; verify SCT in TLS; subscribe to CT alerts,Monitor crt.sh for domain certificates; verify SCT presence; alert on unexpected issuance,No CT monitoring; rogue CA issues certificate undetected; MITM with valid cert,M3 - Insecure Communication,https://certificate.transparency.dev/
Privacy,iOS App Privacy Report Compliance,iOS,Medium,ios app privacy report tracking domain access sensor frequency audit analytics transparency,Privacy Report shows which domains/sensors each app accesses; excessive access erodes trust,Minimize sensor access; audit patterns; declare all tracking in privacy manifest,Audit with Privacy Report; minimize background location; declare all domains in manifest,Access location every minute; connect to 50+ tracking domains; undeclared analytics,M6 - Privacy Violation,https://developer.apple.com/app-privacy-details/
Network,iOS Encrypted Push Notification Payload,iOS,High,push notification apns payload encryption sensitive data notification service extension decrypt,APNS payloads visible to servers; sensitive data should be encrypted end-to-end,Encrypt payload e2e; decrypt in NotificationServiceExtension; show generic text,NotificationServiceExtension: decrypt with Keychain key; show 'New message' until opened,Send OTP account balance in cleartext APNS payload; visible on lock screen,M3 - Insecure Communication,https://developer.apple.com/documentation/usernotifications/unnotificationserviceextension
Platform,iOS Live Activity Data Exposure,iOS,Medium,ios live activity activitykit lockscreen dynamic island sensitive data exposure widget,Live Activities display data on lock screen/Dynamic Island visible without authentication,Never display sensitive data in Live Activities; mask account numbers; minimal status,Show delivery status; mask orderNumber as '****1234'; no balance in Dynamic Island,LiveActivity showing full transaction amount account number on lock screen,M2 - Insecure Data Storage,https://developer.apple.com/documentation/activitykit
Code,iOS Xcode Build Settings Security,iOS,High,xcode build settings strip debug symbols assertions production release configuration audit,Release builds with debug symbols or assertions enabled weaken security posture,Audit settings; ENABLE_NS_ASSERTIONS=NO; STRIP_INSTALLED_PRODUCT=YES for release,Release: DEPLOYMENT_POSTPROCESSING=YES; STRIP_STYLE=all; assertions disabled,Debug settings in release; assertions enabled; full debug symbols shipped,M8 - Security Misconfiguration,https://developer.apple.com/documentation/xcode/build-settings-reference
Code,iOS Method Swizzling Detection,iOS,High,method swizzling objc runtime manipulation hook detection ios interpose dyld,Method swizzling allows attackers to replace implementations intercepting critical calls,Detect method replacement; verify IMP pointers; use Swift-only to reduce swizzling surface,Compare Method IMP against expected; detect objc_msgSend hooks; prefer Swift structs,No runtime checks; methods freely swizzled; login bypass via method_exchangeImplementations,M8 - Code Tampering,https://developer.apple.com/documentation/objectivec/objective-c_runtime
Platform,iOS Core Bluetooth LE Security,iOS,High,ios core bluetooth ble peripheral central encryption pairing bonding gatt privacy,CoreBluetooth LE without proper pairing allows eavesdropping on health/payment data,Use LE Secure Connections; implement bonding; encrypt GATT payloads; validate peripheral,CBCentralManager: filter by service UUID; validate peripheral; encrypt before writeValue,Scan without filter; connect any peripheral; send cleartext health data via GATT,M3 - Insecure Communication,https://developer.apple.com/documentation/corebluetooth
Authentication,iOS Sign in with Apple Security,iOS,High,sign in with apple authentication identity token relay attack nonce privacy validation,Sign in with Apple without nonce validation allows token replay; no server verification,Generate random nonce; verify identity token JWT server-side; handle credential revocation,Include SHA256 nonce; server verifies JWT iss=appleid.apple.com and nonce match,Accept identity token without server validation; no nonce; token replayed,M4 - Insecure Authentication,https://developer.apple.com/sign-in-with-apple/
Platform,iOS Widget Data Security,iOS,Medium,ios widgetkit timeline provider sensitive data display lockscreen homescreen refresh,Widgets display on home/lock screen without authentication; timeline entries cached,Never display sensitive data; use redaction for lock screen; refresh with minimal data,Show masked '****1234'; redact with .privacySensitive(); non-sensitive refresh data,Widget showing full account balance visible on lock screen without authentication,M2 - Insecure Data Storage,https://developer.apple.com/documentation/widgetkit
Network,iOS URLSession Ephemeral Configuration,iOS,Medium,urlsession ephemeral cache cookie credential persistence memory-only sensitive api,URLSession.shared caches responses/cookies to disk; sensitive data persists after logout,Use .ephemeral for sensitive APIs; no disk cache; cleared on dealloc,URLSession(configuration: .ephemeral) for banking; invalidateAndCancel() on logout,URLSession.shared for bank APIs; cached responses persist on disk after logout,M2 - Insecure Data Storage,https://developer.apple.com/documentation/foundation/urlsessionconfiguration
Code,iOS Hardened Runtime Configuration,iOS,High,hardened runtime macos catalyst library validation code injection dylib flags,Hardened Runtime with exceptions weakens security; disable-library-validation allows injection,Enable without exceptions; never use disable-library-validation; audit runtime exceptions,Hardened Runtime enabled; no disable-library-validation; minimal exceptions,disable-library-validation=true; allow-unsigned-executable-memory=true // all disabled,M8 - Security Misconfiguration,https://developer.apple.com/documentation/security/hardened_runtime
Platform,iOS Notification Content Extension Security,iOS,Medium,ios notification content extension rich notification sensitive lock screen category,Content Extensions display rich content on lock screen; sensitive data shown without unlock,Show minimal info; use data validation; require app open for full details,Filter sensitive content in didReceive; show generic preview; require app for details,Content Extension shows medical image with diagnosis visible on lock screen,M2 - Insecure Data Storage,https://developer.apple.com/documentation/usernotificationsui
Authentication,iOS Safari Web Credential Autofill,iOS,Medium,ios safari web credential associated domains webcredentials autofill password shared keychain,Missing webcredentials prevents Safari autofill; misconfigured AASA exposes credentials,Configure webcredentials in Associated Domains; host AASA with correct appIDs,webcredentials:example.com; AASA webcredentials.apps: [TeamID.com.app],No webcredentials; users type passwords manually; misconfigured AASA leaks to wrong app,M4 - Insecure Authentication,https://developer.apple.com/documentation/xcode/supporting-associated-domains
Data Storage,iOS Keychain Cross-Platform Migration,iOS,Medium,keychain migration watchos tvos macos catalyst synchronizable icloud sharing platform,Keychain not configured for cross-platform sharing between iOS/watchOS/macOS apps,Use shared access groups with TeamID prefix; configure kSecAttrSynchronizable,kSecAttrAccessGroup: 'TEAMID.com.app.shared'; kSecAttrSynchronizable: true for cross-device,Separate Keychain per platform; no sync; user re-authenticates on each device,M2 - Insecure Data Storage,https://developer.apple.com/documentation/security/keychain_services
Data Storage,iOS Secure UserDefaults Alternatives,iOS,High,userdefaults alternatives keychain sensitive preferences plist encryption storage categorize,Developers using UserDefaults for semi-sensitive data; plist readable on jailbroken devices,Categorize sensitivity; Keychain for credentials; UserDefaults only for UI preferences,Keychain for tokens; UserDefaults only for isDarkMode theme language; file protection,UserDefaults.set(apiToken forKey: 'token'); UserDefaults.set(ssn forKey: 'ssn'),M2 - Insecure Data Storage,https://developer.apple.com/documentation/foundation/userdefaults
Data Storage,Flutter Hive Database Encryption,Flutter,High,flutter hive nosql encryption box encryptedbox aes key storage local,Hive boxes storing sensitive data without encryption; readable on rooted devices,Use Hive encryptedBox with key from flutter_secure_storage; close box on logout,final key = secureStorage.read(key: 'hiveKey'); Hive.openBox('secure' encryptionCipher: HiveAesCipher(key)),Hive.openBox('userData'); box.put('token' jwt) // unencrypted,M2 - Insecure Data Storage,https://docs.hivedb.dev/#/advanced/encrypted_box
Authentication,Flutter Firebase App Check,Flutter,High,flutter firebase app check attestation play integrity app attest token verification,Firebase callable without App Check allows direct API abuse without app verification,Integrate firebase_app_check with Play Integrity and App Attest; enforce on console,FirebaseAppCheck.instance.activate(androidProvider: playIntegrity appleProvider: appAttest),Firebase calls without App Check; any HTTP client calls Cloud Functions,M8 - Code Tampering,https://firebase.google.com/docs/app-check/flutter/default-providers
Code,Flutter go_router Auth Guards,Flutter,High,flutter go_router redirect authentication guard protected route middleware login,Routes accessible without authentication; deep links bypass login flow,Implement GoRouter redirect with auth state check; protect sensitive routes,GoRouter(redirect: (ctx state) { if (!loggedIn && state.matchedLocation != '/login') return '/login'; }),GoRouter(routes: [GoRoute(path: '/settings' builder: SettingsScreen)]) // no auth,M4 - Insecure Authentication,https://pub.dev/packages/go_router
Code,Flutter Riverpod AutoDispose Security,Flutter,High,flutter riverpod autodispose provider sensitive state memory cleanup token dispose,Providers without autoDispose hold sensitive data indefinitely; visible in DevTools,Use autoDispose for sensitive providers; clear state on logout,StateProvider.autoDispose<String?>((ref) => null); ref.onDispose(() => clearData()),StateProvider<String>((ref) => '') // never disposed; token forever in memory,M2 - Insecure Data Storage,https://riverpod.dev/docs/concepts/modifiers/auto_dispose
Supply Chain,Flutter Package Integrity Verification,Flutter,High,flutter pub.dev package integrity supply chain dependency checksum pubspec.lock,Packages not verified for integrity; dependency confusion attacks possible,Lock deps in pubspec.lock; verify checksums; use dart pub audit for CVEs,pubspec.lock committed; dart pub audit; review before integration; monitor advisories,No pubspec.lock committed; unreviewed transitive deps; no CVE scanning,M6 - Insufficient Supply Chain Security,https://dart.dev/tools/pub/security-advisories
Code,Flutter Web CORS CSP Security,Flutter,Medium,flutter web cors content security policy cross-origin xss iframe browser,Flutter web without CORS/CSP headers vulnerable to XSS and cross-origin attacks,Configure CORS on backend; set strict CSP in index.html; restrict embedding,CSP default-src 'self'; X-Frame-Options: DENY; SameSite cookies,No CSP; no CORS restriction; app embeddable in any iframe; XSS via postMessage,M1 - Improper Platform Usage,https://docs.flutter.dev/platform-integration/web
Data Storage,Flutter Isar Database Encryption,Flutter,Medium,flutter isar database nosql encryption inspector local storage schema,Isar without encryption stores readable binary; Inspector in debug exposes data,Use Isar encryption; disable Inspector in release; encrypt sensitive fields,Isar.open([Schema] inspector: !kReleaseMode encryption: 'password'),Isar.open([Schema]) // inspector enabled; no encryption,M2 - Insecure Data Storage,https://isar.dev/
Code,Flutter ProGuard Native Rules,Flutter,Medium,flutter proguard rules android native r8 obfuscation keep class minify,Default ProGuard rules may strip needed classes or keep too many,Configure custom ProGuard rules; minimize keep; ensure R8 compatibility,proguard-rules.pro: keep Flutter engine; obfuscate app; test release,-keep class ** // keeps everything; defeats obfuscation,M9 - Reverse Engineering,https://docs.flutter.dev/deployment/android#shrinking
Network,Flutter Network Image Cache Security,Flutter,Medium,flutter cached_network_image cache disk sensitive photo medical document,Cached images stored unencrypted; sensitive images accessible on rooted devices,Encrypt cache for sensitive images; clear on logout; memory-only for sensitive,CachedNetworkImage with encrypted CacheManager; maxAge 1h; clear on logout,CachedNetworkImage(imageUrl: medicalScanUrl) // unencrypted; persists after logout,M2 - Insecure Data Storage,https://pub.dev/packages/cached_network_image
Testing,Flutter Integration Test Security,Flutter,Medium,flutter integration test security patrol e2e authentication biometric flow,Security-critical flows not tested e2e; auth regression undetected,Write integration tests for auth; test biometric gates; run in CI,patrol('payment requires biometric' ($) { expect(BiometricPrompt findsOneWidget); }),No integration tests for auth; login bypass undetected; payment without verification,M7 - Client Code Quality,https://docs.flutter.dev/testing/integration-tests
Code,Flutter Dart Zone Error Handling,Flutter,High,flutter dart zone runZonedGuarded uncaught exception sanitize crash reporting,Uncaught exceptions may contain sensitive data sent to crash reporting,Use runZonedGuarded; sanitize errors before reporting; strip PII,runZonedGuarded(() => runApp(app) (error stack) { report(sanitize(error)); }),runApp(app) // uncaught exceptions with tokens sent raw to Crashlytics,M10 - Extraneous Functionality,https://api.dart.dev/stable/dart-async/runZonedGuarded.html
Platform,Flutter Platform View Security,Flutter,Medium,flutter platform view androidview uikitview native embedding webview hybrid,PlatformView embedding native views can bypass Flutter security controls,Restrict to trusted SDKs; validate data passed; audit permissions,AndroidView(viewType: 'trusted-view' creationParams: sanitizedParams),AndroidView(viewType: 'webview' creationParams: {'url': userInput}) // arbitrary URL,M1 - Improper Platform Usage,https://docs.flutter.dev/platform-integration/android/platform-views
Code,Flutter Bloc Observer Production Safety,Flutter,Medium,flutter bloc cubit event state logging observer transition production,BlocObserver logging all transitions in production exposes sensitive state,Conditionally add observer in debug only; strip sensitive state,if (kDebugMode) Bloc.observer = AppBlocObserver() // no observer in production,Bloc.observer = LogAllObserver() // logs AuthState(token: 'eyJ...') in prod,M10 - Extraneous Functionality,https://bloclibrary.dev/
Authentication,Flutter Device Fingerprint Security,Flutter,Medium,flutter device_info_plus fingerprint emulator detection hardware identifier,No device validation allows automated abuse from emulators or clones,Use device_info_plus; detect emulator; server-side fingerprinting,DeviceInfoPlugin().androidInfo: if (!isPhysicalDevice) showWarning; sendFingerprint,No device checks; app identical on emulator; automated attacks undetected,M1 - Improper Platform Usage,https://pub.dev/packages/device_info_plus
Code,Flutter Method Channel Rate Limiting,Flutter,Medium,flutter method channel rate limiting throttle native bridge flood dos,Channel methods callable at unlimited rate; flood causes ANR,Implement rate limiting on native handlers; throttle sensitive operations,Native: check timestamp; reject if <100ms interval; limit 10 calls/sec,invokeMethod('decrypt' data) in tight loop; causes ANR,M1 - Improper Platform Usage,https://docs.flutter.dev/platform-integration/platform-channels
Network,Flutter Dio Interceptor Auth Safety,Flutter,Medium,flutter retrofit dio interceptor auth header token refresh logging,Interceptors not handling token refresh races; exposing auth in errors,Thread-safe token refresh; queue during refresh; strip auth from errors,QueuedInterceptorsWrapper: lock refresh; retry queued; strip Authorization from errors,onError: log(e.requestOptions.headers) // logs auth token on error,M3 - Insecure Communication,https://pub.dev/packages/dio
